BANETTE GENERA ENERGIA PER LANCIARE TERRIBILI MALEDIZIONI, CONFICCANDOSI ALCUNI SPILLI NEL CORPO. ORIGINARIAMENTE QUESTO POKÉMON ERA UN DOLCE PELUCHE, SUCCESSIVAMENTE GETTATO VIA.
I BANETTE SI SONO GENERATI DA PELUCHE VECCHI E ABBANDONATI. PARE CHE VIVANO NELLE DISCARICHE E CHE SI AGGIRINO IN CERCA DEI BAMBINI CHE LI HANNO GETTATI VIA.
PELUCHE TRASFORMATO IN POKÉMON DA UN FORTE ODIO. APPENA APRE LA SUA BOCCA, SPRIGIONA UNA FORTE ENERGIA NEGATIVA.
UN PELUCHE DIVENUTO POKÉMON PER LA RABBIA DI ESSERE STATO BUTTATO VIA DA UN BIMBO, DI CUI È ALLA RICERCA.
UN PELUCHE DIVENUTO POKÉMON PER IL RANCORE DI ESSERE STATO BUTTATO VIA DA UN BIMBO, DI CUI È ALLA RICERCA.
È UN PELUCHE PIENO DI RANCORE PER ESSERE STATO BUTTATO VIA. CERCA SENZA DARSI PACE IL VECCHIO PROPRIETARIO PER VENDICARSI.
È STATO GENERATO DALLA RABBIA PER ESSERE STATO BUTTATO VIA. SI DICE CHE SE CI SI PRENDE CURA DI LUI, TORNERÀ A ESSERE IL PELUCHE DI UN TEMPO.
