QUANDO SOFFIA IL VENTO FORTE, CHIMECHO EMETTE IL SUO VERSO PENZOLANDO DAI RAMI DEGLI ALBERI O DAI CORNICIONI, A CUI SI ATTACCA CON LA VENTOSA CHE HA SUL CAPO. CON LA SUA LUNGA CODA SCOVA LE BACCHE DAL TERRENO E SE NE CIBA.
QUANDO ARRIVA LA STAGIONE CALDA, I CHIMECHO COMINCIANO A SVOLAZZARE DI QUA E DI LÀ, COMUNICANDO FRA DI LORO CON SETTE DIFFERENTI VERSI CARATTERISTICI.
VIAGGIA SOSPINTO DAI VENTI. USA ABILMENTE LA LUNGA CODA PER RACCOGLIERE NOCI E BACCHE, CHE ADORA.
LE SUE URLA SONO COSÌ POTENTI DA FAR VOLAR VIA I NEMICI. COMUNICA CON SETTE VERSI DIFFERENTI.
EMETTE VERSI ULTRASONICI. PERCORRE GRANDI DISTANZE FACENDOSI TRASCINARE DAI VENTI.
I SUOI VERSI RIECHEGGIANO DENTRO IL CORPO VUOTO E FUORIESCONO PER SORPRENDERE E RESPINGERE I NEMICI.
EMETTE 7 TIPI DI VERSI PENZOLANDO DA RAMI O CORNICIONI, A CUI SI ATTACCA CON LA VENTOSA CHE HA SUL CAPO.
EMETTE SETTE TIPI DI VERSI PENZOLANDO DA RAMI O CORNICIONI, A CUI SI ATTACCA CON LA VENTOSA CHE HA SUL CAPO.
QUANDO SOFFIA IL VENTO FORTE, CHIMECHO EMETTE IL SUO VERSO PENZOLANDO DAI RAMI DEGLI ALBERI O DAI CORNICIONI, A CUI SI ATTACCA CON LA VENTOSA CHE HA SUL CAPO.CON LA SUA LUNGA CODA SCOVA LE BACCHE DAL TERRENO E SE NE CIBA.
