SE VIENE ATTACCATO CREA UNA NUVOLA DI COTONE PER CONFONDERE IL NEMICO, POI NE APPROFITTA PER FUGGIRE.
SI SPOSTA SOSPINTO DAL VENTO. NEI GIORNI DI PIOGGIA SI APPESANTISCE E TROVA RIPARO AI PIEDI DI GROSSI ALBERI.
SI SENTONO PIÙ SICURI IN GRUPPO. QUANDO INCONTRANO I LORO SIMILI, NON LI LASCIANO E INSIEME FORMANO UNA GRANDE NUVOLA.
SI SENTONO PIÙ SICURI IN GRUPPO, E QUANDO INCONTRANO I LORO SIMILI NON LI LASCIANO PIÙ FORMANDO COME UNA GRANDE NUVOLA.
IL COTONE PRODOTTO DA COTTONEE VIENE USATO PER CUSCINI E MATERASSI LEGGERI, TRASPIRANTI E DI OTTIMA QUALITÀ.
SE VIENE ATTACCATO, CREA UNA NUVOLA DI COTONE COME DIVERSIVO. IL COTONE CONSUMATO A QUESTO SCOPO RICRESCE IMMEDIATAMENTE.
LE CASE DI ALTA MODA UTILIZZANO PREGIATI TESSUTI REALIZZATI CON IL COTONE PRODOTTO DA COTTONEE ED ELDEGOSS.
