È COSÌ SILENZIOSO QUANDO VOLA NEL BUIO CON LE SUE QUATTRO ALI, CHE È DIFFICILE NOTARLO ANCHE SE È VICINO.
LE ALI SVILUPPATISSIME LO FANNO VOLARE VELOCE, MA GLI RENDONO ANCHE DIFFICILE FERMARSI E RIPOSARSI.
GLI È CRESCIUTO UN ALTRO PAIO DI ALI, CON CUI PUÒ VOLARE IN MODO ANCORA PIÙ RAPIDO E SILENZIOSO.
CROBAT SI AVVICINA FURTIVO ALLA PREDA CON LE SUE ALI SILENZIOSISSIME. QUESTO POKÉMON SI RIPOSA AGGRAPPATO AI RAMI DEGLI ALBERI CON LE ZAMPE POSTERIORI, CHE SERVONO ANCHE DA ALI.
LE SUE QUATTRO ALI GLI PERMETTONO DI VOLARE PIÙ VELOCEMENTE E PIÙ SILENZIOSAMENTE. È ATTIVO DI NOTTE.
LE ZAMPE DI QUESTO POKÉMON SI SONO TRASFORMATE IN ALI E IN QUESTO MODO È DIVENTATO ABILISSIMO A VOLARE.
LA TRASFORMAZIONE DELLE SUE ZAMPE IN ALI LO HA RESO PIÙ LEGGIADRO IN VOLO MA PIÙ GOFFO A TERRA.
VOLA NEL BUIO CON LE SUE QUATTRO ALI IN MODO TALMENTE SILENZIOSO CHE È DIFFICILE NOTARLO ANCHE SE È VICINO.
LE SUE ZAMPE SI SONO TRASFORMATE IN ALI, RENDENDOLO MOLTO GOFFO NEGLI SPOSTAMENTI A TERRA, DOVE ORMAI PUÒ AVANZARE SOLO STRISCIANDO.
SI NUTRE DEL SANGUE DI PERSONE E POKÉMON. SE RIMANE SENZA ANCHE SOLO PER POCO, SI INDEBOLISCE AL PUNTO DI NON RIUSCIRE PIÙ A VOLARE.
