AVVOLGE OGNI COSA CON LA SUA LINGUA ALLUNGABILE. CHI SI AVVICINA TROPPO, SI RITROVERÀ TUTTO BAGNATO DI BAVA.
LA SUA LUNGA LINGUA È SEMPRE UMIDA. LA SALIVA CONTIENE UN SOLVENTE CHE CAUSA INTORPIDIMENTO.
LA SUA SALIVA SCIOGLIE GLI OGGETTI. AVVOLGE OGNI COSA CON LA SUA LINGUA ALLUNGABILE E LA IMPIASTRICCIA TUTTA.
IN FONDO ALLA GOLA HA UNA SACCA DI SALIVA DOVE DEPOSITA TUTTO CIÒ CHE CATTURA CON LA SUA LINGUA.
LA SUA SALIVA CONTIENE UNA SOSTANZA CHE SCIOGLIE QUALSIASI COSA E CAUSA LA PARALISI SE SI VIENE LECCATI.
ESISTE UNA COMPETIZIONE PER STABILIRE QUAL È IL LICKILICKY CHE RIESCE AD ALLUNGARE DI PIÙ LA LINGUA. IL RECORD ATTUALE È DI 25 METRI.
È MOLTO PIÙ BRAVO A USARE LA LINGUA CHE GLI ARTI, TANTO CHE CON ESSA RIESCE AD AFFERRARE PERFINO UN PICCOLO FAGIOLO.
