MAKUHITA È INFATICABILE, PERSEVERANTE E NON PERDE MAI LA SPERANZA. MANGIA MOLTO, DORME MOLTO E SI ALLENA CON RIGORE. QUESTO TENORE DI VITA GLI CONSENTE DI ESSERE SEMPRE CARICO DI ENERGIA.
MAKUHITA AMA MANTENERSI IN FORMA E RAFFORZARE IL PROPRIO CORPO. SE SENTITE UN FRASTUONO PROVENIRE DA UNA GROTTA, È DI SICURO MAKUHITA CHE SI STA ALLENANDO.
SI RAFFORZA ALLENANDOSI DURAMENTE. MOLTO CORAGGIOSO, PUÒ RESISTERE A QUALSIASI ATTACCO.
SI RINFORZA SBATTENDO CONTRO ENORMI ALBERI. VICINO ALLA SUA TANA SI TROVANO PARECCHI ALBERI ABBATTUTI.
SBATTENDO A RIPETIZIONE CONTRO ENORMI ALBERI, SI COSTRUISCE UN CORPO E UNO SPIRITO INDISTRUTTIBILI.
MAKUHITA È INFATICABILE, PERSEVERANTE E NON PERDE MAI LA SPERANZA. MANGIA MOLTO, DORME MOLTO E SI ALLENA CON RIGORE. QUESTO TENORE DI VITA GLI PERMETTE DI ESSERE SEMPRE CARICO DI ENERGIA.
PUR NON ESSENDO UN POKÉMON ORIGINARIO DI ALOLA, OGGI I MAKUHITA DI ALOLA SONO QUELLI PIÙ FAMOSI.
SI ALLENA DURAMENTE OGNI GIORNO ASSIEME AI SUOI COMPAGNI, FERMANDOSI SOLO PER MANGIARE E PER FARE UN PISOLINO.
SI ALLENA TIRANDO MANATE CONTRO GLI ALBERI. A VOLTE FINISCE PER COLPIRE UN EXEGGUTOR, CHE GLI RENDE LA PARIGLIA SCARAVENTANDOLO VIA.
SEMBRA CHE GLI ALLENATORI PREPARINO UN PIATTO TRADIZIONALE PARTICOLARMENTE INDICATO PER FAR CRESCERE FORTI I PROPRI MAKUHITA.
