MILOTIC VIVE SUI FONDALI DEI GRANDI LAGHI. QUANDO IL SUO CORPO RILUCE DI UN ROSA INTENSO, RILASCIA UNA FORTE ONDA ENERGETICA, IN GRADO DI PLACARE GLI SPIRITI INSTABILI.
MILOTIC VIVE SUI FONDALI DI GRANDI LAGHI. PARE ESSERE IL PIÙ BELLO FRA TUTTI I POKÉMON E LA SUA IMMAGINE SI RITROVA IN MOLTISSIME STATUE E DIPINTI.
POKÉMON DI UNA BELLEZZA VERTIGINOSA. CHI LO VEDE PERDE OGNI VOGLIA DI COMBATTERE.
SI DICE CHE SORGA DAI FONDALI DEI LAGHI PER PLACARE GLI ANIMI FURIOSI DELLE PERSONE CHE LITIGANO.
DAVANTI ALLA BELLEZZA DI MILOTIC IL CUORE RITROVA SERENITÀ E DIMENTICA I BRUTTI PENSIERI.
MILOTIC VIVE SUI FONDALI DEI GRANDI LAGHI. QUANDO IL SUO CORPO RILUCE DI UN ROSA INTENSO, RILASCIA UNA FORTE ONDA ENERGETICA, IN GRADO DI PLACARE GLI SPIRITI IRREQUIETI.
VIVE IN LAGHI DALLE ACQUE CRISTALLINE. QUANDO SCOPPIA UNA GUERRA, COMPARE PER PLACARE I CUORI DEGLI ESSERI UMANI.
SI DICE CHE LA SUA BELLEZZA SIA IN GRADO DI ALLEVIARE QUALSIASI DOLORE NEL CUORE DI CHI LO AMMIRA.
