NOTO COME UCCELLO LEGGENDARIO DEL FUOCO, QUANDO SBATTE LE ALI CREA SCINTILLANTI LINGUE INFUOCATE.
QUANDO QUESTO UCCELLO MITICO SBATTE LE ALI DI FUOCO SI INFIAMMA DI ROSSO IL CIELO NOTTURNO.
POKÉMON UCCELLO LEGGENDARIO CHE SEMBRA PORTARE LA PRIMAVERA NEI GELIDI PAESI CHE ATTRAVERSA.
PARE CHE QUESTO POKÉMON UCCELLO LEGGENDARIO SIA SOLITO MIGRARE DA SUD QUANDO GIUNGE LA PRIMAVERA.
MOLTRES È UN POKÉMON UCCELLO LEGGENDARIO, PERFETTAMENTE IN GRADO DI GESTIRE IL FUOCO. SE RIMANE FERITO, SI DICE CHE SI IMMERGA NEL MAGMA LIQUIDO DI UN VULCANO PER ARDERE E TORNARE IN SALUTE.
MOLTRES È UN POKÉMON UCCELLO LEGGENDARIO IN GRADO DI GESTIRE IL FUOCO. SE RIMANE FERITO, SI DICE CHE SI IMMERGA NEL MAGMA DI UN VULCANO PER ARDERE E TORNARE IN SALUTE.
POKÉMON UCCELLO LEGGENDARIO. CHI LO VEDE RESTA SGOMENTO DI FRONTE ALLE SUE ALI ARANCIONE CHE SEMBRANO INFUOCATE.
QUANDO QUESTO POKÉMON ALATO LEGGENDARIO SBATTE LE ALI DI FUOCO, ANCHE IL CIELO NOTTURNO SI TINGE DI ROSSO.
