CRESCENDO, LA PARTE ROCCIOSA DEL SUO CORPO SI INDURISCE DIVENTANDO SIMILE A UN DIAMANTE NERO.
SCAVA VELOCE NEL TERRENO IN CERCA DI CIBO LASCIANDO LUNGHI CUNICOLI USATI POI COME CASA DAI DIGLETT.
SI CONTORCE E SI DIMENA ATTRAVERSO IL TERRENO. IL CUPO BOATO DEL SUO SCAVARE GIUNGE MOLTO LONTANO.
AVANZA CONTORCENDOSI NEL TERRENO CON IL SUO CORPO LUNGO E ROBUSTO. MENTRE SCAVA, MANGIA DI CONTINUO.
COSTRUISCE TUNNEL LUNGHISSIMI INGOIANDO ENORMI QUANTITÀ DI TERRA CON LA SUA BOCCA ENORME.
SCAVA NEL TERRENO CON INCREDIBILE VIGORE IN CERCA DI CIBO, CREANDO CUNICOLI USATI COME TANA DAI DIGLETT.
SCAVA NEL TERRENO ASSORBENDO GLI OGGETTI PIÙ DURI PER IRROBUSTIRE IL SUO CORPO.
