DATO CHE PREDILIGE I TERRENI RICCHI DI ACQUA E NUTRIMENTO, NELLE ZONE IN CUI VIVE PETILIL I RACCOLTI SONO RIGOGLIOSI.
SE LE FOGLIE SUL SUO CAPO CADONO, RICRESCONO SUBITO. SONO MOLTO AMARE, MA SE MASTICATE RIMETTONO SUBITO IN SALUTE.
LE FOGLIE CHE HA SUL CAPO SONO MARISSIME, MA HANNO UN EFFETTO RINVIGORENTE PER IL CORPO. BEVUTE IN INFUSIONE, SONO ANCORA PIÙ EFFICACI.
LE FOGLIE CHE HA SUL CAPO VANNO SPUNTATE DI TANTO IN TANTO PER PERMETTERGLI DI CRESCERE FLORIDO E PIENO.
LE FOGLIE CHE HA SUL CAPO SONO MOLTO AMATE DAGLI ANZIANI PERCHÉ, ESSICCATE AL SOLE E BEVUTE COME TISANA, HANNO UN EFFETTO RINVIGORENTE.
I PETILIL PREDILIGONO I LUOGHI CARATTERIZZATI DA TERRA E ACQUA PULITE. SE IL LORO AMBIENTE SI DETERIORA, SI TRASFERISCONO IN MASSA.
