STRENUO DIFENSORE DEL SUO AMPIO TERRITORIO, BECCA FEROCEMENTE OGNI INTRUSO.
UN POKÉMON PIENO DI VITALITÀ CHE VOLA INSTANCABILE SUL SUO TERRITORIO IN CERCA DI PREDE IGNARE.
HA UNA VISTA ECCELLENTE. PER QUANTO ALTO STIA VOLANDO, SCORGE SEMPRE I MOVIMENTI DELLA PREDA.
IMMOBILIZZA LA PREDA CON ARTIGLI BEN SVILUPPATI, PER POI TRASPORTARLA AL SUO NIDO, A PIÙ DI 100 KM.
PIDGEOTTO DELIMITA COME PROPRIO UN TERRITORIO IMMENSO, CHE DIFENDE CONTROLLANDOLO COSTANTEMENTE. SE TALE TERRITORIO VIENE INVASO, QUESTO POKÉMON NON HA PIETÀ NEL PUNIRE I NEMICI CON I SUOI ARTIGLI AFFILATI.
PIDGEOTTO DIFENDE E CONTROLLA COSTANTEMENTE IL PROPRIO IMMENSO TERRITORIO. SE VIENE INVASO, PUNISCE SENZA PIETÀ I NEMICI CON I SUOI ARTIGLI AFFILATI.
GRAZIE AI POTENTI ARTIGLI PUÒ TRASPORTARE UNA PREDA DELLE DIMENSIONI DI UN EXEGGCUTE PER OLTRE 100 KM.
SORVOLA IL SUO AMPIO TERRITORIO A CACCIA DI PREDE, AFFERRANDOLE CON I SUOI ARTIGLI AFFILATI.
IMMOBILIZZA LA PREDA CON ARTIGLI BEN SVILUPPATI E PUÒ TRASPORTARLA PER PIÙ DI 100 KM FINO AL SUO NIDO.
UN POKÉMON PIENO DI VITALITÀ CHE VOLA INSTANCABILE SUL SUO TERRITORIO IN CERCA DI PREDE.
