MENTRE CALMA IL NEMICO CON IL SUO SGUARDO VACUO, QUESTO POKÉMON ASTUTO USA POTERI PSICOCINETICI.
SOFFRE SEMPRE DI FORTI MAL DI TESTA. USA I SUOI POTERI PSICHICI DI RADO E SENZA VOLERLO.
HA POTERI SOPRANNATURALI MA NON RICORDA DI AVERLI USATI. PER QUESTO SEMBRA SEMPRE PERPLESSO.
SE IL SUO MAL DI TESTA CRONICO SI ACUISCE PUÒ ACQUISTARE STRANI POTERI, PER POI DIMENTICARSENE.
PUÒ USARE I SUOI POTERI MAGICI SOLO QUANDO LE CELLULE CEREBRALI, CASUALMENTE, SI SVEGLIANO.
PSYDUCK USA POTERI MISTERIOSI, CHE SCATENANO ONDE CEREBRALI RILEVABILI APPARENTEMENTE SOLTANTO SU PERSONE IN STATO DI SONNO. QUESTA SCOPERTA HA CAUSATO REAZIONI CONTRASTANTI TRA GLI STUDIOSI.
QUANDO USA I SUOI MISTERIOSI POTERI, PSYDUCK SE NE DIMENTICA SUBITO. APPARENTEMENTE NON RIESCE A RICORDARSENE PERCHÉ ENTRA IN UNO STATO INNATURALE MOLTO SIMILE AD UN SONNO PROFONDO.
QUANDO IL SUO MAL DI TESTA SI FA INTENSO PSYDUCK ACQUISISCE STRANI POTERI, DI CUI POI NON SI RICORDA. PER QUESTO MOTIVO IL SUO SGUARDO RISULTA SEMPRE VACUO E DISTRATTO.
È COSTANTEMENTE TORMENTATO DAL MAL DI TESTA, CHE, QUANDO SI FA PARTICOLARMENTE INTENSO, GLI CONFERISCE STRANI POTERI.
SE LA SUA COSTANTE EMICRANIA PEGGIORA, INIZIA AD USARE POTERI MISTERIOSI. MA POI NON SE LO RICORDA.
TURBATO DALLE SUE ABILITÀ ENIGMATICHE, SOFFRE DI UNA COSTANTE EMICRANIA. A VOLTE USA POTERI MISTERIOSI.
SE IL SUO MAL DI TESTA CRONICO SI ACUISCE, PUÒ ACQUISIRE STRANI POTERI, MA POI SE NE DIMENTICA.
PER EVITARE LE EMICRANIE, NON USA ALCUNE ZONE DEL CERVELLO. SE LO FA, PERÒ, PUÒ SCATENARE UN POTERE MISTERIOSO.
È COSTANTEMENTE TORMENTATO DAL MAL DI TESTA CHE, QUANDO SI FA PARTICOLARMENTE INTENSO, GLI CONFERISCE STRANI POTERI.
PSYDUCK USA POTERI MISTERIOSI, CHE SCATENANO ONDE CEREBRALI RILEVABILI APPARENTEMENTE SOLTANTO SU PERSONE ADDORMENTATE. QUESTA SCOPERTA HA CAUSATO REAZIONI CONTRASTANTI TRA GLI STUDIOSI.
QUANDO USA I SUOI MISTERIOSI POTERI, PSYDUCK SE NE DIMENTICA SUBITO. APPARENTEMENTE NON RIESCE A RICORDARSENE PERCHÉ ENTRA IN UNO STATO INNATURALE MOLTO SIMILE A UN SONNO PROFONDO.
A VOLTE I SUOI POTERI PSICOCINETICI SI ATTIVANO IN MODO INDIPENDENTE DALLA SUA VOLONTÀ E GLI CAUSANO MAL DI TESTA COSÌ FORTI DA FARLO GEMERE.
È COSTANTEMENTE TORMENTATO DAL MAL DI TESTA. PIÙ SI ACUISCONO, MAGGIORE È LA SUA CAPACITÀ DI USARE POTERI PSICOCINETICI.
USARE I SUOI POTERI PSICOCINETICI GLI CAUSA DEI GRAN MAL DI TESTA, PERCIÒ PASSA IL TEMPO CERCANDO DI FARE E PENSARE IL MENO POSSIBILE.
GLI SCIENZIATI HANNO SCOPERTO CHE QUANDO HA MAL DI TESTA LA SUA ATTIVITÀ CEREBRALE AUMENTA DI DIECI VOLTE RISPETTO AL SOLITO.
HA SEMPRE UN FORTE MAL DI TESTA. NON È CHIARO SE UTILIZZI VOLONTARIAMENTE I SUOI POTERI PSICOCINETICI.
