ASSUMONO LA POSIZIONE DIFENSIVA TIRANDO SU FINO AL COLLO LA PELLE, CHE È ELASTICA COME LA GOMMA E PREVIENE I DANNI.
ATTACCA A TESTATE CHIUNQUE ABBIA LA SFORTUNA DI INCROCIARE IL SUO SGUARDO. IL SUO CRANIO È DURISSIMO.
VA FIERO DEL SUO ROBUSTISSIMO CRANIO. TIRA SENZA PREAVVISO TESTATE COSÌ FORTI DA FARLO BARCOLLARE.
GLI SCRAGGY FORMANO PICCOLI GRUPPI E SI METTONO A GIRONZOLARE TIRANDO IMPROVVISAMENTE TESTATE A CHIUNQUE INCROCI IL LORO SGUARDO.
SI PROTEGGE TIRANDO LA PELLE SU FINO AL COLLO. SEMBRA CHE GLI ESEMPLARI DALLA PELLE PIÙ LUNGA SIANO QUELLI PIÙ RISPETTATI.
È MOLTO MOLESTO E PRENDE A TESTATE CHIUNQUE GLI CAPITI A TIRO, PERCIÒ INCROCIARE IL SUO SGUARDO PUÒ ESSERE MOLTO PERICOLOSO.
