NON DORME MAI. DEVE ESSERE SEMPRE IN MOVIMENTO, O IL SUO CORPO DI MAGMA SI RAFFREDDA E SI SECCA.
COMUNE NELLE AREE VULCANICHE, STRISCIA INTORNO LENTAMENTE, SEMPRE ALLA RICERCA DI LUOGHI CALDI.
SI RIUNISCONO IN AREE PIUTTOSTO CALDE. SE CALA LA TEMPERATURA, GLI SI SECCA LA PELLE.
NEL CORPO DI SLUGMA SCORRE MAGMA LIQUIDO. IN CASO DI CONGELAMENTO, IL MAGMA SI RAFFREDDA E SI SOLIDIFICA. IL CORPO DIVENTA FRAGILE E CADE A PEZZI CONSUMANDOSI PROGRESSIVAMENTE.
SE IL SUO CORPO SI RAFFREDDA, LA PELLE SI SOLIDIFICA, IMMOBILIZZANDOLO. PERTANTO SLUGMA VIVE NELLE ZONE VULCANICHE E DORME SEMPRE IN PROSSIMITÀ DEL MAGMA.
SI AGGIRA DI FREQUENTE NELLE ZONE VULCANICHE, SEMPRE ALLA RICERCA DI LUOGHI CALDI.
NON DORME MAI. DEVE ESSERE SEMPRE IN MOVIMENTO O IL SUO CORPO DI MAGMA SI RAFFREDDA E SI SECCA.
COMUNE NELLE AREE VULCANICHE, STRISCIA IN GIRO LENTAMENTE, SEMPRE ALLA RICERCA DI LUOGHI CALDI.
