OGNI ESEMPLARE DI SPINDA HA UN DIVERSO MOTIVO MACULATO SUL CORPO. IL SUO PASSO INCERTO E BARCOLLANTE CONFONDE IL NEMICO, CHE NON RIESCE A PRENDERLO DI MIRA.
OGNI SPINDA HA UN DIVERSO DISEGNO SUL CORPO. I SUOI MOVIMENTI CONFUSI DISORIENTANO I NEMICI.
NON CI SONO DUE SPINDA CON LO STESSO MOTIVO MACULATO. IL SUO PASSO BARCOLLANTE CONFONDE I NEMICI.
LA PROBABILITÀ CHE DUE SPINDA CON LO STESSO DISEGNO SI INCONTRINO È PRATICAMENTE NULLA.
LE PROBABILITÀ CHE DUE SPINDA CON LO STESSO DISEGNO SI INCONTRINO È PRATICAMENTE NULLA.
SI MUOVE CON PASSO INCERTO E BARCOLLANTE, CERCANDO INVANO DI CAMMINARE DRITTO.
OGNI SPINDA HA UN MOTIVO MACULATO UNICO. ALCUNI APPASSIONATI SI DIVERTONO A NOTARE LE DIFFERENZE NELLA POSIZIONE DELLE MACCHIE.
SI MUOVE CON PASSO INCERTO E BARCOLLANTE. SE CAMMINA TROPPO FINISCE PER SENTIRSI MALE.
OGNI SPINDA HA UN MOTIVO MACULATO UNICO. GRAZIE AI SUOI MOVIMENTI INCERTI, RIESCE A SCHIVARE BRILLANTEMENTE GLI ATTACCHI NEMICI.
