TORKOAL SCAVA IN MONTAGNA IN CERCA DI CARBONE. QUANDO LO TROVA, LO USA PER RIEMPIRE LA CAVITÀ DELLA PROPRIA CORAZZA E POI LO BRUCIA. IN CASO DI AGGRESSIONE, EMETTE NUBI DI FUMO NERO PER POI BATTERE IN RITIRATA.
I TORKOAL ELEGGONO A PROPRIA DIMORA MINIERE DI CARBONE ABBANDONATE E VI SCAVANO CARBONE CON ARDORE.
SE IL FUOCO CHE BRUCIA DENTRO LA SUA CORAZZA SI ESTINGUE, LE SUE ENERGIE VITALI SI ESAURISCONO. SE TENUTO IN CASA, DÀ SPESSO FUOCO AGLI OGGETTI.
IL FUMO CHE FUORIESCE DALLA SUA CORAZZA PERMETTE DI CAPIRE IL SUO STATO DI SALUTE. QUANDO I GETTI SONO VIGOROSI, SIGNIFICA CHE STA BENE.
GENERA ENERGIA BRUCIANDO CARBONE E QUANDO LO ESAURISCE NON RIESCE PIÙ A MUOVERSI.
ELEGGE A PROPRIA DIMORA MINIERE ABBANDONATE, DOVE CERCA CARBONE SCAVANDO CON ARDORE.
