QUANDO È NERVOSO, QUESTO POKÉMON SI DIFENDE SPRUZZANDO SUDORE VELENOSO DAI SUOI PORI.
NELLE NOTTI DI LUNA PIENA E QUANDO È AGITATO I CERCHI SUL CORPO EMETTONO UN BAGLIORE GIALLO.
LA LUCE LUNARE HA MUTATO LA STRUTTURA GENETICA DI EEVEE. SI CELA NEL BUIO IN ATTESA DELLA PREDA.
QUANDO È ESPOSTO ALLA LUCE LUNARE I CERCHI SUL SUO CORPO BRILLANO E ACQUISISCE UNO STRANO POTERE.
QUANDO È ESPOSTO ALLA LUCE LUNARE I CERCHI SUL SUO CORPO BRILLANO E SI CARICA DI UNO STRANO POTERE.
QUANDO SI ARRABBIA, SPRUZZA DAI PORI UN SUDORE VELENOSO DIRETTAMENTE SUGLI OCCHI DEL NEMICO.
QUANDO SI ARRABBIA, SPRUZZA DAI PORI UN SUDORE VELENOSO MIRANDO AGLI OCCHI DEL SUO AVVERSARIO.
I CERCHI SUL CORPO EMETTONO UN BAGLIORE GIALLO QUANDO È AGITATO O NELLE NOTTI DI LUNA PIENA.
