È UN BUON SCALATORE, MA PREFERISCE RACCOGLIERE BACCHE SCROLLANDO GLI ALBERI CON LE ZAMPE ANTERIORI.
CON LA SUA ABILITÀ DI DISTINGUERE QUALSIASI ODORE, TROVA CIBO NEL TERRENO ANCHE A GRANDI PROFONDITÀ.
NONOSTANTE LA STAZZA, È ABILE AD ARRAMPICARSI IN CIMA AGLI ALBERI, DOVE MANGIA E DORME.
GRAZIE AL SUO FENOMENALE OLFATTO, TROVA CIBO NEL TERRENO ANCHE A GRANDI PROFONDITÀ.
NEL SUO TERRITORIO, LASCIA GRAFFI SUGLI ALBERI CHE HANNO BACCHE O FRUTTI DELIZIOSI.
ANCHE SE È UN BUONO SCALATORE, RACCOGLIE LE BACCHE SCROLLANDO GLI ALBERI CON LE ZAMPE ANTERIORI.
CON LA SUA CAPACITÀ DI DISTINGUERE QUALSIASI ODORE, TROVA CIBO NEL TERRENO ANCHE A GRANDI PROFONDITÀ.
