VIVE IN GRANDI COLONIE NEL CUORE DELLA GIUNGLA, MA NESSUNO È MAI TORNATO DA LÌ PER RACCONTARLO.
ATTIRA LE PREDE CON IL DOLCE AROMA DEL MIELE, LE INGHIOTTE INTERE E LE DIGERISCE IN UN GIORNO.
QUESTO SPAVENTOSO POKÉMON SIMILE AD UNA PIANTA ATTRAE LA PREDA CON MIELE PROFUMATO E SE LA SCIOGLIE IN BOCCA.
ATTIRA LA PREDA VERSO LA BOCCA SERVENDOSI DI UN AROMA SIMILE AL MIELE, PER POI DISSOLVERLA CON UN SOLVENTE.
PARE CHE VIVA IN GRANDI COLONIE NEL CUORE DELLA GIUNGLA, MA NESSUNO È MAI TORNATO DA LÌ PER RACCONTARLO.
QUESTO SPAVENTOSO POKÉMON SIMILE AD UNA PIANTA ATTRAE LE PREDE CON MIELE PROFUMATO E SE LE SCIOGLIE IN BOCCA.
ATTIRA LE PREDE CON IL DOLCE AROMA DEL MIELE, LE INGHIOTTE E NEL GIRO DI UN GIORNO LE SCIOGLIE COMPLETAMENTE, OSSA INCLUSE.
