DI SOLITO VIVE NELLE CENTRALI ELETTRICHE. SE CONFUSO CON UNA POKÉ BALL, PUÒ ESSERE FATALE.
QUESTO POKÉMON SI TRAVESTE DA POKÉ BALL E APPENA AVVERTE IL PERICOLO SI AUTODISTRUGGE.
VOLTORB È ESTREMAMENTE SENSIBILE, ESPLODE ALLA MINIMA SOLLECITAZIONE. SI DICE CHE SIA STATO CREATO ESPONENDO UNA POKÉ BALL AD UNA FORTE CARICA ENERGETICA.
VOLTORB ASSOMIGLIA INSPIEGABILMENTE A UNA POKÉ BALL. POICHÉ ESPLODE ALLA MINIMA SOLLECITAZIONE, ANCHE GLI ALLENATORI PIÙ ESPERTI LO TRATTANO CON ESTREMA CAUTELA.
SEMBRA UNA POKÉ BALL. TOCCANDOLO SI RISCHIA DI PRENDERE LA SCOSSA E DI FARLO ESPLODERE.
VOLTORB È ESTREMAMENTE SENSIBILE, ESPLODE ALLA MINIMA SOLLECITAZIONE. SI DICE CHE SIA STATO CREATO ESPONENDO UNA POKÉ BALL A UNA FORTE CARICA ENERGETICA.
SI DICE CHE ABBIA UN ASPETTO SIMILE A UNA POKÉ BALL PER PASSARE INOSSERVATO. TENDE AD AUTODISTRUGGERSI AL MINIMO STIMOLO.
