LE PICCOLE ALI NON GLI CONSENTONO DI VOLARE. QUANDO SI AVVICINA IL MOMENTO DI EVOLVERSI, SI LIBERA DEL TESCHIO.
LE SUE ALI SONO ANCORA PICCOLE E NON PUÒ VOLARE. USA DELLE OSSA RICEVUTE DA MANDIBUZZ PER RIPARARE IL SUO BACINO.
PROTEGGE IL DEBOLE BACINO CON I TESCHI DELLE PREDE DI CUI SI NUTRE. MAN MANO CHE CRESCE, DEVE CAMBIARE IL TESCHIO.
È UN GIOCHERELLONE. NON POTENDO VOLARE A CAUSA DELLE ALI POCO SVILUPPATE, SI SPOSTA SALTELLANDO.
HA RICEVUTO IL SUO TESCHIO DA MANDIBUZZ. POICHÉ LE CORTE ALI NON GLI PERMETTONO DI VOLARE, SALTELLA SOGNANDO UN GIORNO DI POTERLO FARE.
INDOSSA IL TESCHIO PER PROTEGGERE IL SUO BACINO. SPESSO LITIGA CON I SUOI CONSIMILI PER ACCAPARRARSI IL TESCHIO PIÙ COMODO.
CRESCE COSÌ VELOCEMENTE CHE IL TESCHIO GLI VA PRESTO STRETTO. I TESCHI SMESSI RESTANO NEL NIDO E VENGONO USATI DALLE GENERAZIONI SUCCESSIVE.
