IL SUO CORPO È MORBIDO E GOMMOSO. SE SI ARRABBIA, ASPIRA ARIA E SI GONFIA ENORMEMENTE.
IL SUO CORPO È ESTREMAMENTE ELASTICO E PUÒ GONFIARSI FINO A DIMENSIONI IMPRESSIONANTI.
HANNO UN PELO COSÌ MORBIDO CHE SE DUE DI LORO SI ABBRACCIANO NON VOGLIONO PIÙ SEPARARSI.
HA UN PELO MOLTO FINE. ATTENZIONE A NON FARLO ADIRARE, PERCHÉ PUÒ GONFIARSI E COLPIRE CON UN BODY SLAM.
IL SUO FOLTO PELO È COSÌ MORBIDO CHE CHIUNQUE LO TOCCHI NON PUÒ FARE A MENO DI CONTINUARE AD ACCAREZZARLO.
WIGGLYTUFF È DOTATO DI OCCHI GRANDI COME DISCHI, RESI LUCIDI DA UN SOTTILE STRATO LACRIMALE IN SUPERFICIE. SE GLI VA DELLA POLVERE NEGLI OCCHI, QUESTA È LAVATA VIA SUBITO.
LA PELLICCIA, ESTREMAMENTE PREGIATA, MORBIDA E FOLTA, HA UN ASPETTO PARTICOLARMENTE ELEGANTE.
IL SUO PELO È MORBIDISSIMO. RIESCE A GONFIARSI E A INGRANDIRSI SEMPLICEMENTE INALANDO ARIA.
HA UN PELO MOLTO BELLO. ATTENZIONE A NON FARLO ADIRARE, PERCHÉ PUÒ GONFIARSI E CARICARE CON TUTTO IL SUO PESO.
IL SUO MANTO È COSÌ SOFFICE AL TATTO CHE SE INIZI AD ACCAREZZARLO, NON RIESCI PIÙ A SMETTERE.
IL SUO CORPO È MORBIDE GOMMOSO. SE SI ARRABBIA, ASPIRA E SI GONFIA ENORMEMENTE.
AL CAMBIO DI STAGIONE PERDE IL SUO MORBIDO MANTO, CHE PUÒ ESSERE RACCOLTO E FILATO PER REALIZZARE PRODOTTI DI LUSSO.
RESPIRA PROFONDAMENTE PER GONFIARSI PIÙ CHE PUÒ. FA A GARA CON GLI ALTRI WIGGLYTUFF A CHI SI GONFIA DI PIÙ.
SE SI ARRABBIA, ASPIRA QUANTA PIÙ ARIA POSSIBILE E SI GONFIA ENORMEMENTE, FINO AD AUMENTARE LA SUA TAGLIA ANCHE DI 20 VOLTE.
